paperId,title,year,venue,fieldsOfStudy
fe257027193ea4a74fdab99d7509ce4002ad7de6,Learning a SAT Solver from Single-Bit Supervision,2018.0,International Conference on Learning Representations,Computer Science
d2a4a1b9b9c22d6b8d26ea9a9c3d8bedd9c9e9e4,Parametric UMAP Embeddings for Representation and Semisupervised Learning,2020.0,Neural Computation,"Computer Science,Biology,Mathematics,Medicine"
5e40edeb996ac1b5d019a47fe43adfbeb8bba654,Adversarial Attacks and Defenses on Graphs,2020.0,SIGKDD Explorations,Computer Science
58bcc1c9b60e761cea4d61fcecf4cff2f6216aa8,ParticleNet: Jet Tagging via Particle Clouds,2019.0,Physical Review D,"Computer Science,Physics"
5d8b271c412f4be0c689bdfde93916efa0951deb,Molecular Property Prediction: A Multilevel Quantum Interactions Modeling Perspective,2019.0,AAAI Conference on Artificial Intelligence,"Physics,Computer Science,Mathematics"
868aeedb84d377810c953d2c042e93890abb6d8b,Pixels to Graphs by Associative Embedding,2017.0,Neural Information Processing Systems,Computer Science
515a21e90117941150923e559729c59f5fdade1c,The Concrete Distribution: A Continuous Relaxation of Discrete Random Variables,2016.0,International Conference on Learning Representations,"Computer Science,Mathematics"
0a053f55804eee01f3c8b4138a1d3364d5bc45ac,M-Walk: Learning to Walk over Graphs using Monte Carlo Tree Search,2018.0,Neural Information Processing Systems,Computer Science
99bc6bbeb0b8d7057a97d361ad0cbc9669d24235,GMAI-MMBench: A Comprehensive Multimodal Evaluation Benchmark Towards General Medical AI,2024.0,Neural Information Processing Systems,"Computer Science,Engineering"
beacbfeb85d8c954fafa4d0f3a405b2c12c3ae03,Bias in medical AI: Implications for clinical decision-making,2024.0,PLOS Digital Health,Medicine
c57fcff0abac314d219641224f1a38fb5ef51c5b,MAISI: Medical AI for Synthetic Imaging,2024.0,IEEE Workshop/Winter Conference on Applications of Computer Vision,"Engineering,Computer Science"
f0a41714b6dbd6cbb26eaf04b92f8c9b704f57fd,Apollo: A Lightweight Multilingual Medical LLM towards Democratizing Medical AI to 6B People,2024.0,,Computer Science
c570f0fce54ffcf666a60b23203e64e5d5d6f1e7,Distribution shift detection for the postmarket surveillance of medical AI algorithms: a retrospective simulation study,2024.0,npj Digital Medicine,"Computer Science,Medicine"
cd805ecc9bb934401c3618c8ac476b1cd4f76107,Why we should not mistake accuracy of medical AI for efficiency,2024.0,npj Digital Medicine,"Computer Science,Medicine"
c10f85e85f0595dc63fc39004e29b29399238880,OpenAI o1-Preview vs. ChatGPT in Healthcare: A New Frontier in Medical AI Reasoning,2024.0,Cureus,Medicine
9c02d6444a08c005026503a68f87df22905f9a05,Shortcut learning in medical AI hinders generalization: method for estimating AI model generalization without external data,2024.0,npj Digital Medicine,"Computer Science,Medicine"
d85346ad92fe13fd00252bf4a30d29ec7af3a888,Patient perspectives on informed consent for medical AI: A web-based experiment,2024.0,Digital Health,Medicine
ef0e678de3d670b7736aa70c97598533667510cd,Expert gaze as a usability indicator of medical AI decision support systems: a preliminary study,2024.0,npj Digital Medicine,"Computer Science,Medicine"
89dd33bf4495617017b65a723060f7257b531966,Ethical and legal challenges of medical AI on informed consent: China as an example.,2024.0,Developing World Bioethics,Medicine
bc954428b654923dc36f4b081b4cccf7f5cd9c45,A trust based framework for the envelopment of medical AI,2024.0,npj Digital Medicine,"Medicine,Computer Science"
3948a98222de7123ddc155db6a9791ef7d759897,Towards trustworthy medical AI ecosystems – a proposal for supporting responsible innovation practices in AI-based medical innovation,2024.0,Ai & Society,Computer Science
e3b7a16163e92caf552adfa2e7f05eee14ef1915,"Performance and exploration of ChatGPT in medical examination, records and education in Chinese: Pave the way for medical AI",2023.0,Int. J. Medical Informatics,"Computer Science,Medicine"
eefb7354958ec0a1bcf801f1a149c715dcdc5a5a,Medical AI and AI for Medical Sciences,2024.0,JMA Journal,Medicine
a6844f6e33469e04302536b09cd19ea8d2b5c8b7,The proposed EU Directives for AI liability leave worrying gaps likely to impact medical AI,2023.0,npj Digit. Medicine,"Medicine,Computer Science"
b515f3be6401456fa724dd621971b2b6051bfd14,Ethics of Medical AI,2024.0,"The International Library of Ethics, Law and Technology",
3473bf66702624bc54a31f86ea5524581cf9f5cf,Characterizing the Clinical Adoption of Medical AI Devices through U.S. Insurance Claims,2023.0,NEJM AI,
da70bc4a3a3e3a2a48c6df29a37f1db8ba7cfd61,Increasing acceptance of medical AI: The role of medical staff participation in AI development,2023.0,Int. J. Medical Informatics,Medicine
f66783ca47d7a633540bb16d459e60ce6e42ea72,Defining Medical AI Competencies for Medical School Graduates: Outcomes of a Delphi Survey and Medical Student/Educator Questionnaire of South Korean Medical Schools,2023.0,Academic medicine : journal of the Association of American Medical Colleges,Medicine
444c8ba8107c7c29bd3e029f01875022bf10a636,Towards General Purpose Medical AI: Continual Learning Medical Foundation Model,2023.0,arXiv.org,Computer Science
80cb9f061b523781eca081431e78daef86f91392,The Virtues of Interpretable Medical AI.,2023.0,Cambridge Quarterly of Healthcare Ethics,Medicine
cbfbe5ca594755b562539022b0d7fd49dc1299a1,Who is afraid of black box algorithms? On the epistemological and ethical basis of trust in medical AI,2021.0,Journal of Medical Ethics,Medicine
c2bf882e3377b511c1b78dec0ba49df2982022eb,Dissection of medical AI reasoning processes via physician and generative-AI collaboration,2023.0,medRxiv,Medicine
54c44cea37126029fe2a7462556fec0527c03192,Generalization in medical AI: a perspective on developing scalable models,2023.0,arXiv.org,Computer Science
850c0d21088d22dafc5e18c1c388c92d5dd6d6d1,Embedded ethics: a proposal for integrating ethics into the development of medical AI,2022.0,BMC Medical Ethics,Medicine
fc1da632130ad49c648c6e55a7726dddf8622e61,How medical AI devices are evaluated: limitations and recommendations from an analysis of FDA approvals,2021.0,Nature Network Boston,Medicine
cef43535daa36e938a7999a66f78a3a96f7f17f5,Governance of Medical AI,2024.0,Asian Bioethics Review,Medicine
d45da740619d01cb6accbf6a08d184dd7e7e5782,Medical AI: is trust really the issue?,2023.0,Journal of Medical Ethics,Medicine
9757f1182971a91038f316c47043b738d051f0e8,Detecting shortcut learning for fair medical AI using shortcut testing,2022.0,Nature Communications,"Medicine,Computer Science"
02c7c78fa8585b4f37420b9e0acbaf77d70108a8,ViLMedic: a framework for research at the intersection of vision and language in medical AI,2022.0,Annual Meeting of the Association for Computational Linguistics,Computer Science
a53b798078e9f94e0059a34eb7c5078c054887c0,MINIMAR (MINimum Information for Medical AI Reporting): Developing reporting standards for artificial intelligence in health care,2020.0,J. Am. Medical Informatics Assoc.,"Medicine,Computer Science"
f23fffd1de68b9f85a2f16d96e07404eb1ab1a52,Are you willing to forgive AI? Service recovery from medical AI service failure,2022.0,Industrial management & data systems,Computer Science
f0e605d53a27b0aa8b1fb1719bc33522ef009996,Piloting a Survey-Based Assessment of Transparency and Trustworthiness with Three Medical AI Tools,2022.0,Healthcare,Medicine
4fd7ea6f6c2032c60033754475cd7da3e06e312f,An objective framework for evaluating unrecognized bias in medical AI models predicting COVID-19 outcomes,2022.0,J. Am. Medical Informatics Assoc.,Medicine
d407f106abb91a3c25795b8c8f831ccd70481848,A unifying force for the realization of medical AI,2022.0,npj Digital Medicine,"Computer Science,Medicine"
359a90b0ec779228cc781e401a2933476bab8cbd,AI-assisted CT imaging analysis for COVID-19 screening: Building and deploying a medical AI system in four weeks,2020.0,medRxiv,Medicine
a63d98ba89060ded321bfe482f69c7edd33953dd,Explainable machine learning practices: opening another black box for reliable medical AI,2022.0,AI and Ethics,Computer Science
8eabd0d28685f1db1a79aa344fe5d0f39c018ba4,Responsibility beyond design: Physicians’ requirements for ethical medical AI,2021.0,Bioethics,Medicine
013213a7fc1e7d2087511a76317f3961713dabba,Explanatory pragmatism: a context-sensitive framework for explainable medical AI,2022.0,Ethics and Information Technology,"Medicine,Computer Science"
b247c01ba4d3abedb9859f467d0d2bb7e80224ff,Medical AI and human dignity: Contrasting perceptions of human and artificially intelligent (AI) decision making in diagnostic and medical resource allocation contexts,2022.0,Computers in Human Behavior,Computer Science
411b81ad541db52bcc79d6e22e0f4f0164fb996a,Trust and Medical AI: The challenges we face and the expertise needed to overcome them,2020.0,J. Am. Medical Informatics Assoc.,"Computer Science,Medicine"
60f6e7824494a394fa8aa58474d40da41d887124,Operationalising fairness in medical AI adoption: detection of early Alzheimer’s disease with 2D CNN,2022.0,BMJ Health & Care Informatics,Medicine
1e554386e5466eda4eb9890e6843fbfa00713c9e,Putting explainable AI in context: institutional explanations for medical AI,2022.0,Ethics and Information Technology,"Medicine,Computer Science"
202f2e0b7ca0e0ac21857da2651384f5b07937de,AI-assisted CT imaging analysis for COVID-19 screening: Building and deploying a medical AI system,2020.0,Applied Soft Computing,"Computer Science,Medicine"
5c529143effc912a1b4e2ba2a48598ab3c07910a,The need to separate the wheat from the chaff in medical informatics: Introducing a comprehensive checklist for the (self)-assessment of medical AI studies,2021.0,Int. J. Medical Informatics,"Medicine,Computer Science"
a3ec8d93139cffacd9321c4c953736cf493dd1cf,Leapfrogging Medical AI in Low-Resource Contexts Using Edge Tensor Processing Unit,2022.0,2022 IEEE Healthcare Innovations and Point of Care Technologies (HI-POCT),
5bc368778a5c82861282c809d8d80d486a233a9c,The European Legal Framework for Medical AI,2020.0,International Cross-Domain Conference on Machine Learning and Knowledge Extraction,"Political Science,Computer Science"
3f2d3454b70c7712b2cb2e16c9c1b72fc5296b46,Is there a civic duty to support medical AI development by sharing electronic health records?,2022.0,BMC Medical Ethics,Medicine
7fdb01361756bdc3447d6027a16c6cdb4d958afb,Toward Human–AI Interfaces to Support Explainability and Causability in Medical AI,2021.0,Computer,Computer Science
8f7626c6eafa05949c9e200444379ed1f3f0a1b9,Before and beyond trust: reliance in medical AI,2021.0,Journal of Medical Ethics,Medicine
641fa8a2e83016f63f50d586fd53cd7e8908f11a,Distributed Governance of Medical AI,2022.0,Social Science Research Network,
9a01f99f3cb2c7bda260073e19d4c1aa15985beb,The Ten Commandments of Ethical Medical AI,2021.0,Computer,Computer Science
7e380946b309770c7b55ea2ae1739c9220e579a5,Trust does not need to be human: it is possible to trust medical AI,2020.0,Journal of Medical Ethics,"Psychology,Medicine"
2c6a057682b932421b1e4b7d5bbbc008527c30f5,Readying Medical Students for Medical AI: The Need to Embed AI Ethics Education,2021.0,arXiv.org,Computer Science
8fd2b272d824d5322928bc40b55c047f35717f8a,Limits of trust in medical AI,2020.0,Journal of Medical Ethics,"Psychology,Computer Science,Medicine"
b1e9cf74c82ca6593fb215356980e1b2b1c327c0,Randomised controlled trials in medical AI: ethical considerations,2021.0,Journal of Medical Ethics,Medicine
781da1fa6a4f733fbc7db043748401a1804698b1,Randomized Controlled Trials in Medical AI A Methodological Critique,2021.0,Philosophy and Medicine,Psychology
05841273b5099efb302e8870670ac38ad446ce2c,A Medical AI Diagnosis Platform Based on Vision Transformer for Coronavirus,2021.0,"2021 IEEE International Conference on Computer Science, Electronic Information Engineering and Intelligent Control Technology (CEI)",Medicine
c44750799665a735eeb8bd15aa831a65ffca888f,"Should we replace radiologists with deep learning? Pigeons, error and trust in medical AI.",2021.0,Bioethics,Medicine
e3df8e70945b6ed3d725f0cfe9b3eb1907e5cdf2,The Three Ghosts of Medical AI: Can the Black-Box Present Deliver?,2020.0,Artif. Intell. Medicine,"Computer Science,Medicine"
cf1f26e7cbed3958b3c2870656568c299fece6e3,Performance of ChatGPT on USMLE: Potential for AI-assisted medical education using large language models,2022.0,medRxiv,Medicine
b7f573342fd02b8a12d0cb301c0eacb7910d68d4,Trustworthy medical AI systems need to know when they don’t know,2021.0,Journal of Medical Ethics,Medicine
f5f544ea91942f210ab12d6ac9f2b34490dac288,Design publicity of black box algorithms: a support to the epistemic and ethical justifications of medical AI systems,2021.0,Journal of Medical Ethics,Medicine
bbc345685247bed2ab1f0cb2d625e8f0e45be882,Overlooked Trustworthiness of Explainability in Medical AI,2021.0,medRxiv,Medicine
0f4516bec40919f75c347ae75b3d67b988d8051f,Assessing Bias in Medical AI,2021.0,,
996f4c9a868ba24ecf7eac3fd6e6a6dcd1c17fae,The Ethics of Medical AI and the Physician-Patient Relationship,2019.0,Cambridge Quarterly of Healthcare Ethics,"Psychology,Medicine"
d7db293916ffe6f9108ddb5c0478247f8e801ad6,Ethical considerations in AI for child health and recommendations for child-centered medical AI,2025.0,npj Digital Medicine,"Computer Science,Medicine"
50791e739e8b36e558c8ef8dfbc681045dc9e2bc,Computer knows best? The need for value-flexibility in medical AI,2018.0,Journal of Medical Ethics,Medicine
ae46acf7e5f07f06d4610f1a92681b450f730ab5,Rethinking clinical trials for medical AI with dynamic deployments of adaptive systems,2025.0,npj Digital Medicine,"Medicine,Computer Science"
f8b90da7b61d9917a68e96c6faef51b4fe3d28f4,The limits of fair medical imaging AI in real-world generalization,2024.0,Nature Network Boston,Medicine
615ac174673a078411063efcbfb5d9c7117dd9e4,Enhancing medical AI with retrieval-augmented generation: A mini narrative review,2025.0,Digital Health,Medicine
d35bfb1976238ae53cae295d5255ed514ab84d46,Medical AI and Contextual Bias,2019.0,,Business
bfeb0006d884900ea27bbea6762228ddbd7ae5d9,How to Evaluate Medical AI,2025.0,arXiv.org,Computer Science
628f241e6ccf6ce5ceb4a1d866935abf31d586da,Generative AI in Medical Practice: In-Depth Exploration of Privacy and Security Challenges,2024.0,Journal of Medical Internet Research,Medicine
6fe6e3d9ebc672124b43149fb8de1915c8c4796d,FDA-Approved Artificial Intelligence and Machine Learning (AI/ML)-Enabled Medical Devices: An Updated Landscape,2024.0,Electronics,
e24d84debe9df56fc4628a257f134c63a231b839,Should we be afraid of medical AI?,2019.0,Journal of Medical Ethics,"Computer Science,Medicine"
f60856ad4d8e0f88da818930bb18aedb58b0dbdf,The medical AI insurgency: what physicians must know about data to practice with intelligent machines,2019.0,npj Digital Medicine,"Computer Science,Medicine"
7114d52833eacffffd0e4aa76e5c7f05d020cc7c,Transparency in medical AI,2020.0,Nature Network Boston,Medicine
71504f6a3db1c6629b8af1da621d1efc078c2494,A Tale of Two Deficits: Causality and Care in Medical AI,2019.0,Philosophy & Technology,Psychology
8b439747d140bb213675b0b2e332fedad15b7818,"Machine Vision, Medical AI, and Malpractice",2019.0,,Computer Science
9a7241281a4826e04754ec98f018343cb6a98836,Medical AI System to Assist Rehabilitation Therapy,2018.0,Industrial Conference on Data Mining,"Medicine,Computer Science"
4a7f6c4e71e20311ade4e76e8d0945d499c31fcd,ChatDoctor: A Medical Chat Model Fine-Tuned on a Large Language Model Meta-AI (LLaMA) Using Medical Domain Knowledge,2023.0,Cureus,"Medicine,Computer Science"
a6ddb4a4a49e799d5cf36574c592ef9c543da7b7,Transparent medical image AI via an image–text foundation model grounded in medical literature,2024.0,Nature Network Boston,Medicine
90e41626b8c78600da70c4350c67c3a10525cb37,MedAlpaca -- An Open-Source Collection of Medical Conversational AI Models and Training Data,2023.0,,Computer Science
adc4bc346850a8047869666cc2112934f3f89d82,A Comprehensive Review on Synergy of Multi-Modal Data and AI Technologies in Medical Diagnosis,2024.0,Bioengineering,Medicine
0c14b3c02b20c097d546d7d78d93406fc6d6d5d7,DeepMind's medical AI,2019.0,New Scientist,Medicine
ed6927c4b8a1a9d43eb0af59690a644749f2a1ba,Trust in Medical AI,2019.0,,Psychology
bf51921bf8338d93e3006f7d46300b3f3b475470,A scoping review of reporting gaps in FDA-approved AI medical devices,2024.0,npj Digital Medicine,"Medicine,Computer Science"
acb2494107d3bef6621fb1d1e2ef42539b6c5535,Navigating the EU AI Act: implications for regulated digital medical products,2024.0,npj Digital Medicine,"Medicine,Computer Science"
923c0639b5879620e18beb85f2e3f4d9244e2b01,Explainability and verification in medical AI,2019.0,,Computer Science
a9e7b6063631e34c93883fe3e5b26d6ec37efbdf,Exploring AI-driven Innovations in Image Communication Systems for Enhanced Medical Imaging Applications,2024.0,Journal of Electrical Systems,
2334c104a2fc630bcc3c7baedad7648d0a4e93be,Influence of believed AI involvement on the perception of digital medical advice,2024.0,Nature Network Boston,Medicine
f9d1413797421f61c58c556eebd4cf20aa940fd5,Medical students’ AI literacy and attitudes towards AI: a cross-sectional two-center study using pre-validated assessment instruments,2024.0,BMC Medical Education,Medicine
5120b4f2a9f9953f887daf8fae550c682bae6d31,AI in medical diagnosis: AI prediction & human judgment,2024.0,Artif. Intell. Medicine,"Computer Science,Medicine"
6dac0409b43c9d021e1acd99310107f3ff797ac1,"Curriculum Frameworks and Educational Programs in AI for Medical Students, Residents, and Practicing Physicians: Scoping Review",2024.0,JMIR Medical Education,Medicine
8ec3205ff3f75bbfeb3f8749e1c0fd65f287c629,Enhancing Medical Interview Skills Through AI-Simulated Patient Interactions: Nonrandomized Controlled Trial,2024.0,JMIR Medical Education,Medicine
df901d279484c574ad4669c01ec02957dcd6b698,AI-Generated Medical Advice-GPT and Beyond.,2023.0,Journal of the American Medical Association (JAMA),Medicine
554b3ea5c82cde1884432259bf83bb8807bfb982,The Current and Future State of AI Interpretation of Medical Images.,2023.0,New England Journal of Medicine,Medicine
67655143fdd9dafe018870e1915149111c8c81b6,Assessing the Accuracy and Reliability of AI-Generated Medical Responses: An Evaluation of the Chat-GPT Model,2023.0,Research Square,Medicine
951027fc8848a7d585125a658b1ac0ac89d9db01,The great detectives: humans versus AI detectors in catching large language model-generated medical writing,2024.0,International Journal for Educational Integrity,
3e2fd4f099046ad3b61d8cad107d5883dc52370a,Bias in AI-based models for medical applications: challenges and mitigation strategies,2023.0,npj Digit. Medicine,"Computer Science,Medicine"
ffa013cd05cf37af43a0c3ec426b5ee5ebdffd65,"A Comparative Analysis of AI Models in Complex Medical Decision-Making Scenarios: Evaluating ChatGPT, Claude AI, Bard, and Perplexity",2024.0,Cureus,Medicine
c2d2d0b4b568df7336a0691ce89cd5c1a3585833,"Global cross-sectional student survey on AI in medical, dental, and veterinary education and practice at 192 faculties",2024.0,BMC Medical Education,Medicine
e3749b0271f0df56d7de52615bd844557923aff0,Evaluating multimodal AI in medical diagnostics,2024.0,npj Digital Medicine,"Medicine,Computer Science"
2afbb5f393a1ca819edda76e40c7ff8820eeb850,"Utilization of, Perceptions on, and Intention to Use AI Chatbots Among Medical Students in China: National Cross-Sectional Study",2024.0,JMIR Medical Education,Medicine
d9fd22425aa3ab659c5425cc513e518c6c1f8f5a,A literature review of artificial intelligence (AI) for medical image segmentation: from AI and explainable AI to trustworthy AI,2024.0,Quantitative Imaging in Medicine and Surgery,Medicine
812ff72377d1cb4c1578f2776d4ca0cfc8264210,AI's Threat to the Medical Profession.,2024.0,Journal of the American Medical Association (JAMA),Medicine
777e53fe90cf797e7dae25c2114bf3866dc66760,AI in medical education: uses of AI in construction type A MCQs,2024.0,BMC Medical Education,Medicine
e548942b23a54f3492d2ff566a6729d8f37278bd,Large language model AI chatbots require approval as medical devices,2023.0,Nature Network Boston,Medicine
88af32439c5fe096218043985bcf7a6a8df4fa74,"AI in medical education: medical student perception, curriculum recommendations and design suggestions",2023.0,BMC Medical Education,Medicine
db5dc8a44511654dc7e0bbebd44f7b502e5e90be,Generative AI for Medical Imaging: extending the MONAI Framework,2023.0,arXiv.org,"Engineering,Computer Science"
8ae39b7549d2a93d550fb733365dc9d540fb5ef1,Malaysian Medical Students’ Attitudes and Readiness Toward AI (Artificial Intelligence): A Cross-Sectional Study,2023.0,Journal of Medical Education and Curricular Development,Medicine
0d208ba4a043296f5f25b566851d9e4ab18de9ae,"AI in Medical Education: Global situation, effects and challenges",2023.0,Education and Information Technologies : Official Journal of the IFIP technical committee on Education,Computer Science
a91f90e610bca15013f5b95de8ab4ca1d92c0173,ChatGPT in medical school: how successful is AI in progress testing?,2023.0,Medical Education Online,Medicine
d2d1e26ab7807b37b6f92966dcdacd6b4a97212d,"ChatGPT and generative AI chatbots: challenges and opportunities for science, medicine and medical leaders",2023.0,BMJ Leader,Medicine
07877e87797096f7e7c9332398d8a7e7633fd1c5,Artificial Intelligence for Medical Diagnostics—Existing and Future AI Technology!,2023.0,Diagnostics,Medicine
1d4a046f2bb1ee8c22d329de6664ffe5f11121fe,Revolutionizing clinical trials: the role of AI in accelerating medical breakthroughs,2023.0,International Journal of Surgery,Medicine
455dfbc280e81e2b425aebd274accfd52d745731,Rethinking Human-AI Collaboration in Complex Medical Decision Making: A Case Study in Sepsis Diagnosis,2023.0,International Conference on Human Factors in Computing Systems,"Computer Science,Medicine"
9fad4781666aa494beffb37092cb78486ecfc172,AI-Powered Chatbots in Medical Education: Potential Applications and Implications,2023.0,Cureus,Medicine
ff437a9a44dbce3faf9534454a9bbdbc12bac3c2,Artificial Intelligence (AI) and Internet of Medical Things (IoMT) Assisted Biomedical Systems for Intelligent Healthcare,2022.0,Biosensors,Medicine
5169de269174ff601674f766a6e2237f3de28c38,Black-box assisted medical decisions: AI power vs. ethical physician care,2023.0,"Medicine, Health care and Philosophy",Medicine
3309b651a0de807b0d3e29f68cc43a53ba775ccc,"AI-Enabled Medical Education: Threads of Change, Promising Futures, and Risky Realities Across Four Potential Future Worlds",2023.0,JMIR Medical Education,Medicine
8b28e758be31ac18afd138cb5d6cb0709e45e655,Teaching AI Ethics in Medical Education: A Scoping Review of Current Literature and Practices,2023.0,Perspectives on Medical Education,Medicine
191e116815a951e3a917d515eb9aa9e892373c88,"Generative AI in Medical Imaging: Applications, Challenges, and Ethics",2023.0,Journal of medical systems,"Medicine,Computer Science"
eecf4b6e567eadc2758ce39148dbb5e64d163106,"Overview: Technology Roadmap of the Future Trend of Metaverse based on IoT, Blockchain, AI Technique, and Medical Domain Metaverse Activity",2022.0,International Conference on Advanced Communication Technology,Computer Science
3cc4a23397951a3fb72916451d5ccb0acb891873,Data infrastructures for AI in medical imaging: a report on the experiences of five EU projects,2023.0,European Radiology Experimental,Medicine
c265940cceba85c5e7b834364dbaef12d077b25e,Applications of Artificial Intelligence (AI) in Medical Education: A Scoping Review,2023.0,"International Conference on Informatics, Management and Technology in Healthcare","Computer Science,Medicine"
6b0570e66cdf79704461e1f8a07dc761ac10d6b6,TRIPOD+AI statement: updated guidance for reporting clinical prediction models that use regression or machine learning methods,2024.0,British medical journal,Medicine
8a55fb02e8d357e00084927b814a8c6719272f59,Medical Students’ Attitudes Toward AI in Medicine and their Expectations for Medical Education,2023.0,medRxiv,Medicine
8b4124dcae7e6c75a0965d82e7a042d70e5c108c,Proposing a Principle-Based Approach for Teaching AI Ethics in Medical Education,2023.0,JMIR Medical Education,Medicine
c696f1b7875089f1a72c283a7a70f216c29325bc,Integrating ChatGPT in Medical Education: Adapting Curricula to Cultivate Competent Physicians for the AI Era,2023.0,Cureus,Medicine
c9f5eacc17437385de1a9eb4c2fc933dbed26ed6,AI and Medical Education - A 21st-Century Pandora's Box.,2023.0,New England Journal of Medicine,Medicine
81600fd653a828d69f6160705be6814dd101beb7,From local explanations to global understanding with explainable AI for trees,2020.0,Nature Machine Intelligence,"Computer Science,Medicine"
771b7b4a78b4193e0e731f410003199db9b19421,Artificial intelligence (AI) in personalized medicine: AI-generated personalized therapy regimens based on genetic and medical history: short communication,2023.0,Annals of Medicine and Surgery,Medicine
f009f99b3b8c1cd6e677b78409fe63bc5d04321b,Analysis of Publication Activity and Research Trends in the Field of AI Medical Applications: Network Approach,2023.0,International Journal of Environmental Research and Public Health,Medicine
8a0f9c0f407ea24e062172687b833aad0df96284,Ground Truth Or Dare: Factors Affecting The Creation Of Medical Datasets For Training AI,2023.0,"AAAI/ACM Conference on AI, Ethics, and Society",Computer Science
c526874e45cbc21715dd587626eb4d4f50a92a1a,Humanizing AI in medical training: ethical framework for responsible design,2023.0,Frontiers in Artificial Intelligence,"Medicine,Computer Science"
750dc68ffb567d79f4d61a99aa347cc0343e65c0,"Unbox the black-box for the medical explainable AI via multi-modal and multi-centre data fusion: A mini-review, two showcases and beyond",2021.0,Information Fusion,"Computer Science,Medicine,Mathematics"
3870f203248262e9815e01beca21c71ba9aa0eed,AI recognition of patient race in medical imaging: a modelling study,2021.0,The Lancet Digital Health,"Medicine,Computer Science,Engineering"
