paperId,title,year,venue,fieldsOfStudy
1258fe759b4c3666f7b91420f1c3c89233a5afa9,From semantics to pragmatics: where IS can lead in Natural Language Processing (NLP) research,2020.0,European Journal of Information Systems,Computer Science
8f42985343b1c98cd892a724912263f89e223d35,Opinion mining on newspaper headlines using SVM and NLP,2019.0,International Journal of Electrical and Computer Engineering (IJECE),Computer Science
98f9b6768b348119359c4fba80c77cd2f549633c,Detecting requirements defects with NLP patterns: an industrial experience in the railway domain,2018.0,Empirical Software Engineering,Computer Science
e618ac0acfff2c4c634748db1414e256c424d5dc,Is it Time to Swish? Comparing Deep Learning Activation Functions Across NLP tasks,2018.0,Conference on Empirical Methods in Natural Language Processing,Computer Science
7557492a09457577d85802763c46555e6bed077e,An RLP23–SOBIR1–BAK1 complex mediates NLP-triggered immunity,2015.0,Nature Plants,"Biology,Medicine"
b525bac2438c296e3b627a61908cd37e66ac7115,Deep Reinforcement Learning for NLP,2018.0,Annual Meeting of the Association for Computational Linguistics,Computer Science
9e3f3d1e1e86cc497315f78617c909ae9a485f21,Explaining Predictions of Non-Linear Classifiers in NLP,2016.0,Rep4NLP@ACL,"Computer Science,Mathematics"
c33fb1782e0067b02acf6e4a83f941befefab660,Combining click-stream data with NLP tools to better understand MOOC completion,2016.0,International Conference on Learning Analytics and Knowledge,Computer Science
ee4f5f354f0409f349c5fe0f413da08d5193e368,Novel Use of Natural Language Processing (NLP) to Predict Suicidal Ideation and Psychiatric Symptoms in a Text-Based Mental Health Intervention in Madrid,2016.0,Comput. Math. Methods Medicine,"Medicine,Psychology,Computer Science"
72f280e47e91b30af24205fa24d53247605aa591,Choosing an NLP Library for Analyzing Software Documentation: A Systematic Literature Review and a Series of Experiments,2017.0,IEEE Working Conference on Mining Software Repositories,Computer Science
6c35070b6824ae5a2af4c667860e87f2c7ef6a9a,"Complementarity, F-score, and NLP Evaluation",2016.0,International Conference on Language Resources and Evaluation,Computer Science
cc0461b68e45bc7208c71d5736a16bb14aa33a1d,Domain reduction techniques for global NLP and MINLP optimization,2017.0,Constraints,"Computer Science,Mathematics"
8472e999f723a9ccaffc6089b7be1865d8a1b863,Towards Linguistically Generalizable NLP Systems: A Workshop and Shared Task,2017.0,"Proceedings of the First Workshop on Building Linguistically
          Generalizable NLP Systems",Computer Science
7944797d30918d713445c4033a5db4b13174fbe2,Automated risk identification using NLP in cloud based development environments,2017.0,,Computer Science
87f714f3534c7a3ca2bf41ce5825139ddc8247bf,What to do about non-standard (or non-canonical) language in NLP,2016.0,Conference on Natural Language Processing,Computer Science
6017846621ae9937745725fb41a5227e18aef6f8,A STUDY ON NLP APPLICATIONS AND AMBIGUITY PROBLEMS SHAIDAH JUSOH,2018.0,,
7d4d45f164370c368f00f713dc4b1b2f810b2a01,Clinical documentation variations and NLP system portability: a case study in asthma birth cohorts across institutions,2017.0,J. Am. Medical Informatics Assoc.,"Computer Science,Medicine"
100245924f903092d3dc86657adaba366e4c6a19,Using NLP to Detect Requirements Defects: An Industrial Experience in the Railway Domain,2017.0,Requirements Engineering: Foundation for Software Quality,"Computer Science,Engineering"
f76757cb35e45b06fb585ca65372e0ff99d2aea3,A survey on the state-of-the-art machine learning models in the context of NLP,2016.0,,Computer Science
51fefbb9ccfd5d5570b6a7aaddf93b056a57c6a5,The Applications of Natural Language Processing (NLP) for Software Requirement Engineering - A Systematic Literature Review,2017.0,International Conference on Information Science and Applications,Computer Science
5cc2204e1f74101d3076ebddefeed17b48596f74,Towards a Seamless Integration of Word Senses into Downstream NLP Applications,2017.0,Annual Meeting of the Association for Computational Linguistics,Computer Science
df1e12648b45c1868a20dc77931a0f81753d52ae,A Survey on Techniques in NLP,2016.0,,Computer Science
c4be6e98e384d032dbfd4835d1675807f656bd02,Overview of NLP-TEA 2016 Shared Task for Chinese Grammatical Error Diagnosis,2016.0,NLP-TEA@COLING,Computer Science
168faeb22d9199ef0a389fdc89e4be26a990f9d3,NLP-driven citation analysis for scientometrics,2016.0,Natural Language Engineering,Computer Science
de8050af0cfad7d28ea901bf80a78241ed8f3afb,TextImager: a Distributed UIMA-based System for NLP,2016.0,International Conference on Computational Linguistics,Computer Science
d83413f7f785aae067d49332239c3a36c346ba99,EstNLTK - NLP Toolkit for Estonian,2016.0,International Conference on Language Resources and Evaluation,Computer Science
7988eaef00000224bfd89f7700ac9a64a24e9fcb,Inverted indexing for cross-lingual NLP,2015.0,Annual Meeting of the Association for Computational Linguistics,Computer Science
3febb2bed8865945e7fddc99efd791887bb7e14f,Deep Contextualized Word Representations,2018.0,North American Chapter of the Association for Computational Linguistics,Computer Science
a54b56af24bb4873ed0163b77df63b92bd018ddc,"DistilBERT, a distilled version of BERT: smaller, faster, cheaper and lighter",2019.0,arXiv.org,Computer Science
ff0b2681d7b05e16c46dfb71d980cc2f605907cd,Finetuned Language Models Are Zero-Shot Learners,2021.0,International Conference on Learning Representations,Computer Science
a9e155fda1d97baa2b8712f580cc61887cc64e9b,ChatGPT outperforms crowd workers for text-annotation tasks,2023.0,Proceedings of the National Academy of Sciences of the United States of America,"Computer Science,Medicine"
84109e1235b725f4bb44a54bab8b493bd723fdd3,Towards General Text Embeddings with Multi-stage Contrastive Learning,2023.0,arXiv.org,Computer Science
5b7f5488c380cf5085a5dd93e993ad293b225eee,One Fits All: Power General Time Series Analysis by Pretrained LM,2023.0,Neural Information Processing Systems,Computer Science
16f01c1b3ddd0b2abd5ddfe4fdb3f74767607277,Time-LLM: Time Series Forecasting by Reprogramming Large Language Models,2023.0,International Conference on Learning Representations,Computer Science
1e43c7084bdcb6b3102afaf301cce10faead2702,BioBERT: a pre-trained biomedical language representation model for biomedical text mining,2019.0,Bioinform.,"Computer Science,Medicine"
141a5033d9994242b18bb3b217e79582f1ee9306,Scaling Up Visual and Vision-Language Representation Learning With Noisy Text Supervision,2021.0,International Conference on Machine Learning,Computer Science
ca2f1088d3e581b2c6c75cf0ebc96506d620f64d,On the Dangers of Stochastic Parrots: Can Language Models Be Too Big? 🦜,2021.0,"Conference on Fairness, Accountability and Transparency",Computer Science
af88ce6116c2cd2927a4198745e99e5465173783,Bidirectional LSTM-CRF Models for Sequence Tagging,2015.0,arXiv.org,Computer Science
03055978e278960de9fbb5c648b1779ef9f26cd1,Can Large Language Models Be an Alternative to Human Evaluations?,2023.0,Annual Meeting of the Association for Computational Linguistics,Computer Science
14b65a86c82e38fce0eb3506e0d4084ad5cdb583,DeBERTa: Decoding-enhanced BERT with Disentangled Attention,2020.0,International Conference on Learning Representations,Computer Science
f402971f33a07333bb81394aa3d0c0e93ca2b960,A Scoping Literature Review of Natural Language Processing Application to Safety Occurrence Reports,2023.0,Safety,
5fc3830322f7eae2934c912c391ee5edded86a15,Open X-Embodiment: Robotic Learning Datasets and RT-X Models : Open X-Embodiment Collaboration,2024.0,IEEE International Conference on Robotics and Automation,Computer Science
156d217b0a911af97fa1b5a71dc909ccef7a8028,SciBERT: A Pretrained Language Model for Scientific Text,2019.0,Conference on Empirical Methods in Natural Language Processing,Computer Science
131c6f328c11706de2c43cd16e0b7c5d5e610b6a,Harnessing the Power of LLMs in Practice: A Survey on ChatGPT and Beyond,2023.0,ACM Transactions on Knowledge Discovery from Data,Computer Science
a3c0719d847a8cab836500a0ee3b9f4717ed136d,From human writing to artificial intelligence generated text: examining the prospects and potential threats of ChatGPT in academic writing.,2023.0,Biology of Sport,Medicine
26aa6fe2028b5eefbaa40ab54ef725bbbe7d9810,ConceptNet 5.5: An Open Multilingual Graph of General Knowledge,2016.0,AAAI Conference on Artificial Intelligence,Computer Science
18faafb15d7e7a8ad923b293f8c945c35680a2ef,ChatGPT and Open-AI Models: A Preliminary Review,2023.0,Future Internet,Computer Science
85e7d63f75c0916bd350a229e040c5fbb1472e7a,Making Pre-trained Language Models Better Few-shot Learners,2021.0,Annual Meeting of the Association for Computational Linguistics,Computer Science
e816f788767eec6a8ef0ea9eddd0e902435d4271,Don’t Stop Pretraining: Adapt Language Models to Domains and Tasks,2020.0,Annual Meeting of the Association for Computational Linguistics,Computer Science
832fff14d2ed50eb7969c4c4b976c35776548f56,REALM: Retrieval-Augmented Language Model Pre-Training,2020.0,International Conference on Machine Learning,Computer Science
d0086b86103a620a86bc918746df0aa642e2a8a3,Language Models as Knowledge Bases?,2019.0,Conference on Empirical Methods in Natural Language Processing,Computer Science
a2f38d03fd363e920494ad65a5f0ad8bd18cd60b,Domain-Specific Language Model Pretraining for Biomedical Natural Language Processing,2020.0,ACM Trans. Comput. Heal.,Computer Science
30c0cdc414f68211d5d0514df027cec22e005174,A Survey on In-context Learning,2022.0,Conference on Empirical Methods in Natural Language Processing,Computer Science
ce2d5b5856bb6c9ab5c2390eb8b180c75a162055,Recent Trends in Deep Learning Based Natural Language Processing,2017.0,IEEE Computational Intelligence Magazine,Computer Science
f45f85fa1beaa795c24c4ff86f1f2deece72252f,A decoder-only foundation model for time-series forecasting,2023.0,International Conference on Machine Learning,Computer Science
8e7e4f3f7cb32f3a93b5f6fda367af3e9b04c243,Using natural language processing to analyse text data in behavioural science,2025.0,Nature Reviews Psychology,
a710cd1bd3c9ac374e79daed5b0442ce5cc364fa,BERT applications in natural language processing: a review,2025.0,Artificial Intelligence Review,Computer Science
eba36ac75bf22edf9a1bfd33244d459c75b98305,Recurrent Convolutional Neural Networks for Text Classification,2015.0,AAAI Conference on Artificial Intelligence,Computer Science
d33a14592d68da068953cdf37f8bf562740c0085,An Empirical Evaluation of Prompting Strategies for Large Language Models in Zero-Shot Clinical Natural Language Processing: Algorithm Development and Validation Study,2024.0,JMIR Medical Informatics,Medicine
80d0116d77beeded0c23cf48946d9d10d4faee14,GLaM: Efficient Scaling of Language Models with Mixture-of-Experts,2021.0,International Conference on Machine Learning,Computer Science
57be0eee785bbfd669c1f51e9a3681105b7f82be,The Benefits and Challenges of ChatGPT: An Overview,2023.0,Frontiers in Computing and Intelligent Systems,
8ae9a17c87a4518b513e860683a0ef7824be994d,Exploiting Cloze-Questions for Few-Shot Text Classification and Natural Language Inference,2020.0,Conference of the European Chapter of the Association for Computational Linguistics,Computer Science
332dc8b2ca9d49fad607c7282f3360bb2a9aacf3,A large language model for electronic health records,2022.0,npj Digital Medicine,"Computer Science,Medicine"
4aa9f5150b46320f534de4747a2dd0cd7f3fe292,Semi-supervised Sequence Learning,2015.0,Neural Information Processing Systems,Computer Science
98a6b07d51261df9418981c1dddf09ad4a9c48e4,Event Extraction via Dynamic Multi-Pooling Convolutional Neural Networks,2015.0,Annual Meeting of the Association for Computational Linguistics,Computer Science
fc97c3f375c7228a1df7caa5c0ce5d2a6a171bd7,What Disease does this Patient Have? A Large-scale Open Domain Question Answering Dataset from Medical Exams,2020.0,Applied Sciences,Computer Science
72cdd6ebe0221fb568ef20534f44ba5b35190a56,BERTweet: A pre-trained language model for English Tweets,2020.0,Conference on Empirical Methods in Natural Language Processing,Computer Science
62ad7ea9467bbcdbfe325b9ee561cab3908e4583,MEGA: Multilingual Evaluation of Generative AI,2023.0,Conference on Empirical Methods in Natural Language Processing,Computer Science
bd20069f5cac3e63083ecf6479abc1799db33ce0,A Primer in BERTology: What We Know About How BERT Works,2020.0,Transactions of the Association for Computational Linguistics,Computer Science
a76706d350b8c483a3aff73e61b91d15b5687335,Universal Sentence Encoder,2018.0,arXiv.org,Computer Science
93b4cc549a1bc4bc112189da36c318193d05d806,AllenNLP: A Deep Semantic Natural Language Processing Platform,2018.0,arXiv.org,Computer Science
006fdeff6e1a81c404317ee4056d6cc72f9c0e50,Multimodal Language Analysis in the Wild: CMU-MOSEI Dataset and Interpretable Dynamic Fusion Graph,2018.0,Annual Meeting of the Association for Computational Linguistics,Computer Science
2573af4e13d9a5dddb257d22cd38a600528d9a8b,MobileBERT: a Compact Task-Agnostic BERT for Resource-Limited Devices,2020.0,Annual Meeting of the Association for Computational Linguistics,Computer Science
6b8b2075319accc23fef43e4cf76bc3682189d82,Attention-Based Bidirectional Long Short-Term Memory Networks for Relation Classification,2016.0,Annual Meeting of the Association for Computational Linguistics,Computer Science
2f2d8f8072e5cc9b296fad551f65f183bdbff7aa,Exploring the Limits of Language Modeling,2016.0,arXiv.org,Computer Science
dfbfa21a93c3164ae8a033398c8de42b03b1b84d,ChatGPT Beyond English: Towards a Comprehensive Evaluation of Large Language Models in Multilingual Learning,2023.0,Conference on Empirical Methods in Natural Language Processing,Computer Science
95a251513853c6032bdecebd4b74e15795662986,What Does BERT Look at? An Analysis of BERT’s Attention,2019.0,BlackboxNLP@ACL,Computer Science
2ff41a463a374b138bb5a012e5a32bc4beefec20,Pre-Training with Whole Word Masking for Chinese BERT,2019.0,arXiv.org,Computer Science
5f994dc8cae24ca9d1ed629e517fcc652660ddde,ERNIE: Enhanced Language Representation with Informative Entities,2019.0,Annual Meeting of the Association for Computational Linguistics,Computer Science
d51ed05fd05b9d222427a05a87ed88217447b44f,A Deep Relevance Matching Model for Ad-hoc Retrieval,2016.0,International Conference on Information and Knowledge Management,Computer Science
80cf2a6af4200ecfca1c18fc89de16148f1cd4bf,Patient Knowledge Distillation for BERT Model Compression,2019.0,Conference on Empirical Methods in Natural Language Processing,Computer Science
c3a3c163f25b9181f1fb7e71a32482a7393d2088,Encoding Sentences with Graph Convolutional Networks for Semantic Role Labeling,2017.0,Conference on Empirical Methods in Natural Language Processing,Computer Science
f797fd44b9ddd5845611eb7a705ca9464a8819d1,Very Deep Convolutional Networks for Text Classification,2016.0,Conference of the European Chapter of the Association for Computational Linguistics,Computer Science
8724579d3f126e753a0451d98ff57b165f722e72,Are aligned neural networks adversarially aligned?,2023.0,Neural Information Processing Systems,Computer Science
450b5490cc653478c272be50aa986798df828a20,Uncovering ChatGPT’s Capabilities in Recommender Systems,2023.0,ACM Conference on Recommender Systems,Computer Science
e154dd91de91558f9d671370754eace62a54c911,A study of generative large language model for medical research and healthcare,2023.0,npj Digit. Medicine,"Computer Science,Medicine"
3bcb17559ce96eb20fa79af8194f4af0380d194a,Pre-trained models for natural language processing: A survey,2020.0,Science China Technological Sciences,Computer Science
19cd2250f419666d4df441bae7ade1dd9a2f6bf9,ChatGPT in Healthcare: A Taxonomy and Systematic Review,2023.0,medRxiv,"Medicine,Computer Science"
c23d9d44e8bc68408cea9f305d1f24d915bc0d0d,Recent Advances in Natural Language Processing via Large Pre-trained Language Models: A Survey,2021.0,ACM Computing Surveys,Computer Science
bc8fa64625d9189f5801837e7b133e7fe3c581f7,Learned in Translation: Contextualized Word Vectors,2017.0,Neural Information Processing Systems,Computer Science
d16ab5c19ed33a263b6412ac41a4ea1f068d254a,Revisiting Pre-Trained Models for Chinese Natural Language Processing,2020.0,Findings,Computer Science
e2587eddd57bc4ba286d91b27c185083f16f40ee,What do you learn from context? Probing for sentence structure in contextualized word representations,2019.0,International Conference on Learning Representations,Computer Science
319b84be7a843250bc81d7086f79a4126d550277,ERNIE 3.0: Large-scale Knowledge Enhanced Pre-training for Language Understanding and Generation,2021.0,arXiv.org,Computer Science
4bfc842cfadc632de84709945c870fb8608162d9,Sentiment Analysis,2020.0,Encyclopedia of Social Network Analysis and Mining,Computer Science
02eaaf87f9cae34cca398fed146079e6eeb1f868,"Climbing towards NLU: On Meaning, Form, and Understanding in the Age of Data",2020.0,Annual Meeting of the Association for Computational Linguistics,Computer Science
3465c06c872d8c48d628c5fc2d484087719351b6,LayoutLM: Pre-training of Text and Layout for Document Image Understanding,2019.0,Knowledge Discovery and Data Mining,Computer Science
26299d5fdc5137291dc6a091573b3d18aba1d1c2,MAD-X: An Adapter-based Framework for Multi-task Cross-lingual Transfer,2020.0,Conference on Empirical Methods in Natural Language Processing,Computer Science
d13bb317e87f3f6da10da11059ebf4350b754814,"Survey of the State of the Art in Natural Language Generation: Core tasks, applications and evaluation",2017.0,Journal of Artificial Intelligence Research,Computer Science
f52b48a988489ed4d1c53f98e77aa34669547a94,Comparative Study of CNN and RNN for Natural Language Processing,2017.0,arXiv.org,Computer Science
cddf40e579a596d0110b260313adf43470617c4c,Datasets: A Community Library for Natural Language Processing,2021.0,Conference on Empirical Methods in Natural Language Processing,Computer Science
7102bb3fe73bd057ff161d9db5214a267c1ef312,FinBERT: Financial Sentiment Analysis with Pre-trained Language Models,2019.0,arXiv.org,Computer Science
84913d6f08942ddf8dd51418820537abfaa5ae19,vq-wav2vec: Self-Supervised Learning of Discrete Speech Representations,2019.0,International Conference on Learning Representations,Computer Science
d70fe318d5fa97dab6ceaa3a5f14869f45b384dd,Natural Language Processing for Dialects of a Language: A Survey,2024.0,ACM Computing Surveys,Computer Science
2a8b6f990a5ddf0122aae82a46359b03031f302b,"Using millions of emoji occurrences to learn any-domain representations for detecting sentiment, emotion and sarcasm",2017.0,Conference on Empirical Methods in Natural Language Processing,"Mathematics,Computer Science"
1adadbfa95e43a70fcd17e6ce947a0652b86bfc3,Documenting Large Webtext Corpora: A Case Study on the Colossal Clean Crawled Corpus,2021.0,Conference on Empirical Methods in Natural Language Processing,Computer Science
109929be7890ef982fb3b6be0d78609cfab1ea13,"PIXIU: A Large Language Model, Instruction Data and Evaluation Benchmark for Finance",2023.0,arXiv.org,Computer Science
21aff006cf2acb8e8fdab1bbd19f9d9a1f4cbc7f,"Generative Pre-Trained Transformer-Empowered Healthcare Conversations: Current Trends, Challenges, and Future Directions in Large Language Model-Enabled Medical Chatbots",2024.0,BioMedInformatics,
ab70853cd5912c470f6ff95e95481980f0a2a41b,SMART: Robust and Efficient Fine-Tuning for Pre-trained Natural Language Models through Principled Regularized Optimization,2019.0,Annual Meeting of the Association for Computational Linguistics,"Computer Science,Mathematics"
2fa3f7ce620a1c7155daef6620dd6bb0e01934f3,"Beto, Bentz, Becas: The Surprising Cross-Lingual Effectiveness of BERT",2019.0,Conference on Empirical Methods in Natural Language Processing,Computer Science
9fcdbfdf28245010c875ce85502351fe05c04b49,Exploring Collaboration Mechanisms for LLM Agents: A Social Psychology View,2023.0,arXiv.org,Computer Science
efbe2903ce921d6aa7ad6055c53511e0e6f25fa1,A Review of the Trends and Challenges in Adopting Natural Language Processing Methods for Education Feedback Analysis,2023.0,IEEE Access,Computer Science
5001630bcc65e8e0e621b19625629a2689724743,Generative Judge for Evaluating Alignment,2023.0,International Conference on Learning Representations,Computer Science
767dcc48c7ad2c943f3c1a25c46b873e7b8b3bc8,Glot500: Scaling Multilingual Corpora and Language Models to 500 Languages,2023.0,Annual Meeting of the Association for Computational Linguistics,Computer Science
0bb4cadc80c0afaf29c57518dc9c06f8fcfa5f38,Semi-supervised sequence tagging with bidirectional language models,2017.0,Annual Meeting of the Association for Computational Linguistics,Computer Science
26e743d5bd465f49b9538deaf116c15e61b7951f,Learning Distributed Representations of Sentences from Unlabelled Data,2016.0,North American Chapter of the Association for Computational Linguistics,Computer Science
049f4c438ce9eefa622ae5ba5fb7e34443b86133,Lipstick on a Pig: Debiasing Methods Cover up Systematic Gender Biases in Word Embeddings But do not Remove Them,2019.0,North American Chapter of the Association for Computational Linguistics,"Computer Science,Art"
d78aed1dac6656affa4a04cbf225ced11a83d103,Revealing the Dark Secrets of BERT,2019.0,Conference on Empirical Methods in Natural Language Processing,"Computer Science,Mathematics"
0302438b3656971ea3741b71d0da6e4c417c74cf,"A Comprehensive Study of ChatGPT: Advancements, Limitations, and Ethical Considerations in Natural Language Processing and Cybersecurity",2023.0,Inf.,Computer Science
5f2c083f80073c56c41c4ea66ae48312513c55aa,Energy and Policy Considerations for Modern Deep Learning Research,2020.0,AAAI Conference on Artificial Intelligence,Computer Science
8071b53a46b0eb368741afcd90c3f93d95f56fdc,Natural Language Generation and Understanding of Big Code for AI-Assisted Programming: A Review,2023.0,Entropy,"Computer Science,Medicine"
a0e49f65b6847437f262c59d0d399255101d0b75,What BERT Is Not: Lessons from a New Suite of Psycholinguistic Diagnostics for Language Models,2019.0,Transactions of the Association for Computational Linguistics,Computer Science
135112c7ba1762d65f39b1a61777f26ae4dfd8ad,Is Attention Interpretable?,2019.0,Annual Meeting of the Association for Computational Linguistics,Computer Science
493fac37cea49afb98c52c2f5dd75c303a325b25,Mitigating Gender Bias in Natural Language Processing: Literature Review,2019.0,Annual Meeting of the Association for Computational Linguistics,Computer Science
0d360a1256ccdfca58cf98d12243df8407fd442d,Weight Poisoning Attacks on Pretrained Models,2020.0,Annual Meeting of the Association for Computational Linguistics,"Computer Science,Mathematics"
ad31866da7f14ae21bd38df0a3b1ffd1a1438122,An efficient framework for learning sentence representations,2018.0,International Conference on Learning Representations,Computer Science
686d9ee744fa013cc21cdd86acd864c936e9e456,Large language models are few-shot clinical information extractors,2022.0,Conference on Empirical Methods in Natural Language Processing,Computer Science
02926bce47bf12e2f64a8a38e7820524b48ab07b,"Probabilistic Extension of Precision, Recall, and F1 Score for More Thorough Evaluation of Classification Models",2020.0,EVAL4NLP,Computer Science
44a5d4b7ab16910c101755b0d7d78594f6c58bb3,"Computational Linguistics: 16th International Conference of the Pacific Association for Computational Linguistics, PACLING 2019, Hanoi, Vietnam, October 11–13, 2019, Revised Selected Papers",2020.0,Introducing Linguistics,
7245e15da2a0f09aeca6c1e7478237985f7e4819,A Survey on Recent Advances in Named Entity Recognition from Deep Learning models,2018.0,International Conference on Computational Linguistics,Computer Science
157a7ae44613a1fcf34e2be8c1e19a4f6e3c50e3,Transfer Learning in Natural Language Processing,2019.0,North American Chapter of the Association for Computational Linguistics,Computer Science
5eab810cc5d90de1c52127d1a5824f0817f46c30,"Natural Language Reasoning, A Survey",2023.0,ACM Computing Surveys,Computer Science
ee8085bd00f437318cce5b919b47233de8c5f6ff,Pharmacovigilance from social media: mining adverse drug reaction mentions using sequence labeling with word embedding cluster features,2015.0,J. Am. Medical Informatics Assoc.,"Medicine,Computer Science"
894e8cf18cbec9251d7c911b9433cc85f7150d51,Natural language processing for mental health interventions: a systematic review and research framework,2023.0,Translational Psychiatry,Medicine
099f8bf42b95a4c239bc338b05821b592c60f44b,Natural language processing applied to mental illness detection: a narrative review,2022.0,npj Digital Medicine,"Medicine,Computer Science"
1d95011355628f7aef068ab1914198e43258c530,BERTimbau: Pretrained BERT Models for Brazilian Portuguese,2020.0,Brazilian Conference on Intelligent Systems,Computer Science
5328e5dc801d1cf0f997621519f6b31d79021006,Sentiment analysis using product review data,2015.0,Journal of Big Data,Computer Science
70b98d90767345b15e0569082c0e4ac661279b5d,Is GPT-3 a Good Data Annotator?,2022.0,Annual Meeting of the Association for Computational Linguistics,Computer Science
311fd5f6f114ae51f8cbd95a0da69d7b556d25f1,Neural Theory-of-Mind? On the Limits of Social Intelligence in Large LMs,2022.0,Conference on Empirical Methods in Natural Language Processing,Computer Science
a6bd16c1b5674b2227b291a6059cf311f47ab520,SemEval-2023 Task 11: Learning with Disagreements (LeWiDi),2023.0,International Workshop on Semantic Evaluation,Computer Science
ac11062f1f368d97f4c826c317bf50dcc13fdb59,Dissecting Contextual Word Embeddings: Architecture and Representation,2018.0,Conference on Empirical Methods in Natural Language Processing,Computer Science
142e40cd1543700fb1a3b67e028375209fba6dd2,Artificial Intelligence Augmented Qualitative Analysis: The Way of the Future?,2023.0,Qualitative Health Research,Medicine
0276f1b3a2b5f8d4bfa1dd0af5e9e7cf6f034393,Natural Language Processing in the Legal Domain,2023.0,Social Science Research Network,Computer Science
