paperId,title,year,venue,fieldsOfStudy
ab376f85d36f3af1778e5560421c6cb6c2fefd1b,Deep Reinforcement Learning for Multiobjective Optimization,2019.0,IEEE Transactions on Cybernetics,"Computer Science,Mathematics,Medicine"
8ede7ddf99986d69562455bc8d69222fc3e27350,Recurrent Experience Replay in Distributed Reinforcement Learning,2018.0,International Conference on Learning Representations,Computer Science
30de3c20bbe9562e1fbce162d84de593a073bc15,Prefrontal cortex as a meta-reinforcement learning system,2018.0,Nature Neuroscience,"Psychology,Biology,Medicine"
1796f6f928079f935748dad59f6ed6fdbba960c8,Graph Convolutional Reinforcement Learning,2018.0,International Conference on Learning Representations,"Computer Science,Mathematics"
5956c34032126185d8ad19695e4a1a191c08b5a1,Deep reinforcement learning for page-wise recommendations,2018.0,ACM Conference on Recommender Systems,Computer Science
9a8e6feb271bf1cce8b1393cf41e70692a7f6625,Verifiable Reinforcement Learning via Policy Extraction,2018.0,Neural Information Processing Systems,"Computer Science,Mathematics"
bcdb21ca1703fc6f62df420626e36d138480a6a1,Action Robust Reinforcement Learning and Applications in Continuous Control,2019.0,International Conference on Machine Learning,"Computer Science,Mathematics"
b4e69b0172d69c80f83366c296b6222805360445,SQIL: Imitation Learning via Reinforcement Learning with Sparse Rewards,2019.0,International Conference on Learning Representations,Computer Science
e4b4066e46fd160cb84e246b0895a4cd674d8ce4,Safe Reinforcement Learning via Shielding,2017.0,AAAI Conference on Artificial Intelligence,"Mathematics,Computer Science"
86a1a83d5ffc3875a523cb8f6ce416b70c38e984,CityFlow: A Multi-Agent Reinforcement Learning Environment for Large Scale City Traffic Scenario,2019.0,The Web Conference,Computer Science
7dc156eb9d84ae8fd521ecac5ccc5b5426a42b50,A Survey of Reinforcement Learning Informed by Natural Language,2019.0,International Joint Conference on Artificial Intelligence,"Computer Science,Mathematics"
ddea0e5c27ff91cda7ba50e1231aa7f7d076e58b,"Reinforcement Learning, Fast and Slow",2019.0,Trends in Cognitive Sciences,"Medicine,Psychology"
232bd009964a9bbf4757227aae94d1a139350e04,OpenSpiel: A Framework for Reinforcement Learning in Games,2019.0,arXiv.org,"Computer Science,Mathematics"
f844925066c3de9cd9ad662059e25a9d47a59843,Causal Discovery with Reinforcement Learning,2019.0,International Conference on Learning Representations,"Computer Science,Mathematics"
3660f76126fe1343c91f065f452845981041206c,A Survey on Transfer Learning for Multiagent Reinforcement Learning Systems,2019.0,Journal of Artificial Intelligence Research,"Computer Science,Mathematics"
0732925ffaf7ee525a57786f7c9791491ef084db,Learning to Schedule Communication in Multi-agent Reinforcement Learning,2019.0,International Conference on Learning Representations,Computer Science
e72e1b3bd6d35fd666adf29ead5ce657481864a6,Online Deep Reinforcement Learning for Computation Offloading in Blockchain-Empowered Mobile Edge Computing,2019.0,IEEE Transactions on Vehicular Technology,Computer Science
b0d8165eecf2aa04a85e701d0c6bb4edd4b3811b,A Unified Game-Theoretic Approach to Multiagent Reinforcement Learning,2017.0,Neural Information Processing Systems,Computer Science
17b6829678802a20e51558ec28c5369414defe42,Data Valuation using Reinforcement Learning,2019.0,International Conference on Machine Learning,"Computer Science,Mathematics"
00ec8123dd2ba03afab7c1fa02f774062f769181,Using Reward Machines for High-Level Task Specification and Decomposition in Reinforcement Learning,2018.0,International Conference on Machine Learning,Computer Science
eae2a3cc90087c2c3db61085253b3b1c05322d77,Exploratory Combinatorial Optimization with Reinforcement Learning,2019.0,AAAI Conference on Artificial Intelligence,"Computer Science,Mathematics"
471f9742b4e32d8ee68f9ee493768ff0466a231d,Automatic Goal Generation for Reinforcement Learning Agents,2017.0,International Conference on Machine Learning,"Computer Science,Mathematics"
615e443f15778e9fdde27fecebd5c6d028816e27,Dealing with Non-Stationarity in Multi-Agent Deep Reinforcement Learning,2019.0,arXiv.org,"Computer Science,Mathematics"
53f8181a5a414f77e3d887bb20878178f3e8f859,Entity Abstraction in Visual Model-Based Reinforcement Learning,2019.0,Conference on Robot Learning,"Computer Science,Mathematics"
3606c313dccd21f784bedf5759152a3677f5719d,Behaviour Suite for Reinforcement Learning,2019.0,International Conference on Learning Representations,"Computer Science,Mathematics"
25a7b8c2e110a1bcd5c42ab5de55a0c08b0b8846,Double Reinforcement Learning for Efficient Off-Policy Evaluation in Markov Decision Processes,2019.0,Journal of machine learning research,"Computer Science,Mathematics"
cf90552b5d2e992e93ab838fd615e1c36618e31c,Distral: Robust multitask reinforcement learning,2017.0,Neural Information Processing Systems,"Mathematics,Computer Science"
4c54efd3b9ce84f4268b165f5896c0692a50bcd1,Learning Action Representations for Reinforcement Learning,2019.0,International Conference on Machine Learning,"Computer Science,Mathematics"
bb905c6b8d9abe84adad1c6784e6037dc9516e95,Probabilistic Recursive Reasoning for Multi-Agent Reinforcement Learning,2019.0,International Conference on Learning Representations,"Computer Science,Mathematics"
a473f545318325ba23b7a6b477485d29777ba873,ViZDoom: A Doom-based AI research platform for visual reinforcement learning,2016.0,IEEE Conference on Computational Intelligence and Games,"Mathematics,Computer Science"
d8686b657b61a37da351af2952aabd8b281de408,Successor Features for Transfer in Reinforcement Learning,2016.0,Neural Information Processing Systems,Computer Science
c43bba87b4237a93d96b2a3e91da25d91fd0bb91,Programmatically Interpretable Reinforcement Learning,2018.0,International Conference on Machine Learning,"Mathematics,Computer Science"
75a760c6bd5ae15e0fc489a074bc42bc1fc4e697,"Safe, Multi-Agent, Reinforcement Learning for Autonomous Driving",2016.0,arXiv.org,"Computer Science,Mathematics"
d77bc27d16a362e5e1b727904c3789355dda6062,Molecular de-novo design through deep reinforcement learning,2017.0,Journal of Cheminformatics,"Computer Science,Medicine"
1bead9000a719cb258bac7320228055aee650d2c,Leveraging Demonstrations for Deep Reinforcement Learning on Robotics Problems with Sparse Rewards,2017.0,arXiv.org,Computer Science
9d4d8509f6da094a7c31e063f307e0e8592db27f,"A Survey of Inverse Reinforcement Learning: Challenges, Methods and Progress",2018.0,Artificial Intelligence,"Computer Science,Mathematics"
68c108795deef06fa929d1f6e96b75dbf7ce8531,Meta-Reinforcement Learning of Structured Exploration Strategies,2018.0,Neural Information Processing Systems,"Mathematics,Computer Science"
b3dae9529f3caeeec9cc6872e94aa690418acb22,Reinforcement Learning for Relation Classification From Noisy Data,2018.0,AAAI Conference on Artificial Intelligence,"Computer Science,Mathematics"
9d01ca964043a52b265534e94abc37210a50cc5a,Kinematic State Abstraction and Provably Efficient Rich-Observation Reinforcement Learning,2019.0,International Conference on Machine Learning,"Computer Science,Mathematics"
65769b53e71ea7c52b3a07ad32bd4fdade6a0173,Multi-task Deep Reinforcement Learning with PopArt,2018.0,AAAI Conference on Artificial Intelligence,"Mathematics,Computer Science"
2a49a71c9d40051a03c4445fe49025bc75d9eeb6,Meta-Gradient Reinforcement Learning,2018.0,Neural Information Processing Systems,"Computer Science,Mathematics"
e5afacab42153f24b8e4ca543bd0ecae4e810f10,Multi-Agent Adversarial Inverse Reinforcement Learning,2019.0,International Conference on Machine Learning,"Computer Science,Mathematics"
8ef87e938b53c7f3ffdf47dfc317aa9b82848535,Reinforcement Learning: Theory and Algorithms,2019.0,,
dc3e905bfb27d21675ee1720413e007b014b37d3,Safe and Efficient Off-Policy Reinforcement Learning,2016.0,Neural Information Processing Systems,"Mathematics,Computer Science"
741ebf91225327bbd11e0e4fa08e329d45637b13,Optimism in Reinforcement Learning with Generalized Linear Function Approximation,2019.0,International Conference on Learning Representations,"Mathematics,Computer Science"
dee85f0ed3571d7b591e23000848c584242186ef,Composable Deep Reinforcement Learning for Robotic Manipulation,2018.0,IEEE International Conference on Robotics and Automation,"Computer Science,Mathematics,Engineering"
b29a82bf55fcb451c148eb6e0dadf4e3569c4f8f,ChainerRL: A Deep Reinforcement Learning Library,2019.0,Journal of machine learning research,"Computer Science,Mathematics"
76dceabf5f6d3dcedc89746046b42009375978bc,Decentralized non-communicating multiagent collision avoidance with deep reinforcement learning,2016.0,IEEE International Conference on Robotics and Automation,Computer Science
e7da7f3df7ec029a5d19ae743aa2482cb03768e6,Statistics and Samples in Distributional Reinforcement Learning,2019.0,International Conference on Machine Learning,"Computer Science,Mathematics"
b68673a166f9c620e13152f63d358fb8fce7850d,Deep Decentralized Multi-task Multi-Agent Reinforcement Learning under Partial Observability,2017.0,International Conference on Machine Learning,Computer Science
98c08d28a2319ce79b62b108dfed3acc0dd80983,Collaborative Evolutionary Reinforcement Learning,2019.0,International Conference on Machine Learning,"Computer Science,Mathematics"
6bc692616db7b1a7ef2ea7c270c893adfb57ed0e,Deep Reinforcement Learning and the Deadly Triad,2018.0,arXiv.org,Computer Science
caea502325b6a82b1b437c62585992609b5aa542,Assessing Generalization in Deep Reinforcement Learning,2018.0,arXiv.org,"Computer Science,Mathematics"
059a1297a61afc812de48edede631229608dc513,Survey of Model-Based Reinforcement Learning: Applications on Robotics,2017.0,J. Intell. Robotic Syst.,Computer Science
c85b3bd562039471b54b03eebbae2ae5c6a574cc,A Reinforcement Learning Based Approach for Automated Lane Change Maneuvers,2018.0,2018 IEEE Intelligent Vehicles Symposium (IV),"Computer Science,Engineering"
9e09cff6cd4c0cfbe9675cd1f0ae67c9c75a8ac9,Control of a Quadrotor With Reinforcement Learning,2017.0,IEEE Robotics and Automation Letters,Computer Science
ec8a2f6cfe72309f5f1608d22ec28778d3ee976a,Data-Efficient Off-Policy Policy Evaluation for Reinforcement Learning,2016.0,International Conference on Machine Learning,"Computer Science,Mathematics"
1fe4d11d8ce3d033dbead6f4a567f86fe21bf8ee,Neural Logic Reinforcement Learning,2019.0,International Conference on Machine Learning,"Computer Science,Mathematics"
9862caed8ee93321c78b0196e0b7eef516b545ba,Reverse Curriculum Generation for Reinforcement Learning,2017.0,Conference on Robot Learning,Computer Science
8f06c78435b9712aa77094796075b8e6b3f50c05,Causal Reasoning from Meta-reinforcement Learning,2019.0,arXiv.org,"Computer Science,Mathematics"
1e6abd43fcb157fde4d4ddc3ac8787ae45dbf777,Cooperative Inverse Reinforcement Learning,2016.0,Neural Information Processing Systems,Computer Science
d9b1d6313615e81ce862273373e48a72293b3223,Reinforcement Learning with Neural Networks for Quantum Feedback,2018.0,Physical Review X,"Physics,Mathematics,Computer Science"
ba7bf6e857da202314176895ec2bc47d330256e2,Learning to Optimize Join Queries With Deep Reinforcement Learning,2018.0,arXiv.org,Computer Science
4941f1f8bbf53d4093a417c37f6a7e4c2c707ae3,When does reinforcement learning stand out in quantum control? A comparative study on state preparation,2019.0,npj Quantum Information,"Physics,Computer Science"
e4a89a978f747d0b548f5887b2380c5f618061f0,Near-Optimal Representation Learning for Hierarchical Reinforcement Learning,2018.0,International Conference on Learning Representations,Computer Science
5e49c80f8b12a100c5f4518897c4cbf72710c252,Relational Deep Reinforcement Learning,2018.0,arXiv.org,"Computer Science,Mathematics"
16481307a862ddae514045b13b944ca043c36a4b,Generative Adversarial User Model for Reinforcement Learning Based Recommendation System,2018.0,International Conference on Machine Learning,"Computer Science,Mathematics"
d8a545a02aa0e0cbe42607212433b2b4f446e5ab,Reinforcement Learning in Financial Markets,2019.0,International Conference on Data Technologies and Applications,"Computer Science,Business"
ccf8dd6f5602d0c2be46eab1bd0d04424aa060ef,Latent Space Policies for Hierarchical Reinforcement Learning,2018.0,International Conference on Machine Learning,"Computer Science,Mathematics"
15a06d8601539b5eb6df5baf6bc4c3bdefb34855,Deep Reinforcement Learning for Sequence-to-Sequence Models,2018.0,IEEE Transactions on Neural Networks and Learning Systems,"Computer Science,Mathematics,Medicine"
7b35984b9b0bde78290cf92d8176682b65e59f54,GPU-Accelerated Robotic Simulation for Distributed Reinforcement Learning,2018.0,Conference on Robot Learning,"Computer Science,Engineering"
c37e0d93d19efbd8bb50d1a4d92979793f4341d2,Reinforcement Learning from Imperfect Demonstrations,2018.0,International Conference on Learning Representations,"Computer Science,Mathematics"
236b40f3144b95cd84779484c8269092122920aa,Tactics of Adversarial Attack on Deep Reinforcement Learning Agents,2017.0,International Joint Conference on Artificial Intelligence,"Computer Science,Mathematics"
b4a4edebbb25211333098a54c060847e54c1a991,Virtual-Taobao: Virtualizing Real-world Online Retail Environment for Reinforcement Learning,2018.0,AAAI Conference on Artificial Intelligence,Computer Science
fb9693183bc74568c72188431c18cb2b07c87213,Hierarchical Imitation and Reinforcement Learning,2018.0,International Conference on Machine Learning,"Computer Science,Mathematics"
86d5f469f0f541f0b2223d2d3e80f22fb1d66af7,A Deep Reinforcement Learning Strategy for UAV Autonomous Landing on a Moving Platform,2018.0,Journal of Intelligent and Robotic Systems,Computer Science
d9402be5d4df663d59450d398d109ab92aae3717,Dynamic Weights in Multi-Objective Deep Reinforcement Learning,2018.0,International Conference on Machine Learning,"Computer Science,Mathematics"
26b90ccf7541fd2cd4235118493e1e49d358c351,StarCraft Micromanagement With Reinforcement Learning and Curriculum Transfer Learning,2018.0,IEEE Transactions on Emerging Topics in Computational Intelligence,Computer Science
ee9893ff2aa325ff3c9920f247436c514fd8b512,SOLAR: Deep Structured Representations for Model-Based Reinforcement Learning,2018.0,International Conference on Machine Learning,Computer Science
412fbb7ffa29aa6b2e172c1f545223baf18f1b6e,Practical Deep Reinforcement Learning Approach for Stock Trading,2018.0,arXiv.org,"Computer Science,Economics,Mathematics"
e0b65d3839e3bf703d156b524d7db7a5e10a2623,Playing FPS Games with Deep Reinforcement Learning,2016.0,AAAI Conference on Artificial Intelligence,Computer Science
d4e137eeec6ca4883df9f9cf40cc49f62e8388be,Multi-agent Reinforcement Learning in Sequential Social Dilemmas,2017.0,Adaptive Agents and Multi-Agent Systems,Computer Science
1cb6edbedc4a1ac5c32f61a435a23264e42a9071,Towards Sample Efficient Reinforcement Learning,2018.0,International Joint Conference on Artificial Intelligence,Computer Science
cb1092c1bb7d021fab6b4976ea3a51cc6d61f59b,Distributed Economic Dispatch in Microgrids Based on Cooperative Reinforcement Learning,2018.0,IEEE Transactions on Neural Networks and Learning Systems,"Computer Science,Medicine"
6865bc5ff0d28da7d2857f5821afc645c1e80807,Benchmarks for reinforcement learning in mixed-autonomy traffic,2018.0,Conference on Robot Learning,Computer Science
050a89a91b3e828c841972a81f17807f82c79713,SURREAL: Open-Source Reinforcement Learning Framework and Robot Manipulation Benchmark,2018.0,Conference on Robot Learning,Computer Science
c4f529934b6f22aa38e014e295a9737daa6e7db5,Lipschitz Continuity in Model-based Reinforcement Learning,2018.0,International Conference on Machine Learning,"Mathematics,Computer Science"
0f710daa7bbba3350169f0bbb5d24f8db3e5199e,Self-Consistent Trajectory Autoencoder: Hierarchical Reinforcement Learning with Trajectory Embeddings,2018.0,International Conference on Machine Learning,"Computer Science,Mathematics"
920febb03475b068286a855c10ea09b968fe7ee3,Reinforcement Learning of Theorem Proving,2018.0,Neural Information Processing Systems,Computer Science
163a35665374fcd5283da47a7ee611af7df2d876,Deep reinforcement learning for building HVAC control,2017.0,Design Automation Conference,"Engineering,Computer Science"
2a38aeccad784c9b0b87019fefaa2accdc052d5b,Learning State Representations for Query Optimization with Deep Reinforcement Learning,2018.0,DEEM@SIGMOD,Computer Science
40cc7cdffa0a861cb557410518246d97d1678642,Benchmarking Reinforcement Learning Algorithms on Real-World Robots,2018.0,Conference on Robot Learning,"Computer Science,Mathematics"
31f5864ada5fb08b69da74b6d5ad99e385dcc737,Sentence Simplification with Deep Reinforcement Learning,2017.0,Conference on Empirical Methods in Natural Language Processing,Computer Science
a2141a5ec0c65ea0a9861ae562f4c9fb8020d197,DARLA: Improving Zero-Shot Transfer in Reinforcement Learning,2017.0,International Conference on Machine Learning,"Computer Science,Mathematics"
13481ca12437363220282e3255eab109f0eeebcc,Reinforcement Learning with Perturbed Rewards,2018.0,AAAI Conference on Artificial Intelligence,"Computer Science,Mathematics"
b80991d12b41a5a68dc14dd87b692c0f903ceb9c,Some Considerations on Learning to Explore via Meta-Reinforcement Learning,2018.0,International Conference on Learning Representations,Computer Science
cf4d2e27da4ff7ee6dbd0e7a844db833444437d1,PEORL: Integrating Symbolic Planning and Hierarchical Reinforcement Learning for Robust Decision-Making,2018.0,International Joint Conference on Artificial Intelligence,"Mathematics,Computer Science"
c18df1edc0a45891806d44896a8f666944e93d01,Learning Cooperative Visual Dialog Agents with Deep Reinforcement Learning,2017.0,IEEE International Conference on Computer Vision,Computer Science
3f4c70c93c30352ed2b0259307ac51b5b6ffd478,State Abstractions for Lifelong Reinforcement Learning,2018.0,International Conference on Machine Learning,Computer Science
43c0f5ebd97225369e88418b4e957c3d592c0389,Self-Paced Prioritized Curriculum Learning With Coverage Penalty in Deep Reinforcement Learning,2018.0,IEEE Transactions on Neural Networks and Learning Systems,"Computer Science,Medicine"
8037db97f3cadb842ffa4bee83d59878fe7974d0,Sim-to-Real Reinforcement Learning for Deformable Object Manipulation,2018.0,Conference on Robot Learning,"Computer Science,Engineering"
64a2b359144f3eaea6f24101053fed8c24717c70,Optimizing Quantum Error Correction Codes with Reinforcement Learning,2018.0,Quantum,"Mathematics,Computer Science,Physics"
bf8d58faf972ad0a1026c0a7c5577c07996ef3a7,Hierarchical Deep Reinforcement Learning for Continuous Action Control,2018.0,IEEE Transactions on Neural Networks and Learning Systems,"Computer Science,Medicine"
941ba185f01b1a0a27453fd178aa5f010510ee8b,Learning Robust Rewards with Adverserial Inverse Reinforcement Learning,2018.0,International Conference on Learning Representations,Computer Science
0d9595193c6b87494d168b1bcc03c4ad10642c72,Reinforcement Learning and Deep Reinforcement Learning,2021.0,Deep Learning in Science,Computer Science
84bb62e3f40434a1e367d24783bd81432a5396d6,Integrating State Representation Learning Into Deep Reinforcement Learning,2018.0,IEEE Robotics and Automation Letters,Computer Science
b93317f61c6ed99542da9d1d691ded9732c16c1c,Unsupervised Meta-Learning for Reinforcement Learning,2018.0,arXiv.org,"Computer Science,Mathematics"
c889d6f98e6d79b89c3a6adf8a921f88fa6ba518,Model-Agnostic Meta-Learning for Fast Adaptation of Deep Networks,2017.0,International Conference on Machine Learning,Computer Science
3a13f7c43b767b1fb72ef107ef62a4ddd48dd2a7,Modular Multitask Reinforcement Learning with Policy Sketches,2016.0,International Conference on Machine Learning,Computer Science
d09223da6cf1ae3b7692095a05fe45f5e6a95a13,Traffic signal timing via deep reinforcement learning,2016.0,IEEE/CAA Journal of Automatica Sinica,Engineering
168b7d0ab57a331a228ce21ffd1becbb93066f79,Neural Optimizer Search with Reinforcement Learning,2017.0,International Conference on Machine Learning,"Computer Science,Mathematics"
6337bd57197c818fb5ab539004d64b0cf51ce2d5,Reinforcement Learning,2020.0,A Guided Tour of Artificial Intelligence Research,"Computer Science,Mathematics"
84082634110fcedaaa32632f6cc16a034eedb2a0,A Survey of Preference-Based Reinforcement Learning Methods,2017.0,Journal of machine learning research,"Computer Science,Mathematics"
3b6c891fbccaa564ea4fd8914a5e3952fcf42ee3,Robust Deep Reinforcement Learning with Adversarial Attacks,2017.0,Adaptive Agents and Multi-Agent Systems,"Mathematics,Computer Science"
d0edf834c1d86aac1835e23c11b23b8723b65136,Learning how to Active Learn: A Deep Reinforcement Learning Approach,2017.0,Conference on Empirical Methods in Natural Language Processing,Computer Science
a1d2a7ef81960846b9cec00bce8eefa06ccc8796,Deep Reinforcement Learning from Self-Play in Imperfect-Information Games,2016.0,arXiv.org,"Computer Science,Mathematics"
ef45dc196af747363b610e7e16f9f555ad7915af,Reinforcement Learning in Different Phases of Quantum Control,2017.0,Physical Review X,"Computer Science,Physics"
7541c956a13f50d8ffbef853539b466f6a77a80d,Virtual to Real Reinforcement Learning for Autonomous Driving,2017.0,British Machine Vision Conference,Computer Science
953c6f0c1ae5311e1bcc523fbba2de57d751c248,Deep-Reinforcement Learning Multiple Access for Heterogeneous Wireless Networks,2017.0,2018 IEEE International Conference on Communications (ICC),Computer Science
f2c20cb6ebd2ad704c5bcae4eb8b942d3c62f8e0,Uncertainty-Aware Reinforcement Learning for Collision Avoidance,2017.0,arXiv.org,Computer Science
bfbd10ebffc9494423770a5bd30ebd0f9cbce66d,Device Placement Optimization with Reinforcement Learning,2017.0,International Conference on Machine Learning,Computer Science
7f710932a0aa99f2c2ddbec6e7765f10c48d3fc2,Learning Invariant Feature Spaces to Transfer Skills with Reinforcement Learning,2017.0,International Conference on Learning Representations,Computer Science
1bd66197d692581f4ac507107184ca9110b61d7d,SBEED: Convergent Reinforcement Learning with Nonlinear Function Approximation,2017.0,International Conference on Machine Learning,Computer Science
30834ae1497c35d362eea14857d93c28d2d12b57,Zero-Shot Task Generalization with Multi-Task Deep Reinforcement Learning,2017.0,International Conference on Machine Learning,Computer Science
314ee6b03f8c6c3533d2107fe05f9909b9202cbd,Deep Reinforcement Learning for Mention-Ranking Coreference Models,2016.0,Conference on Empirical Methods in Natural Language Processing,Computer Science
3c63f8b8263cd6cc4c8c7429d46bb656accddc49,Hybrid Reward Architecture for Reinforcement Learning,2017.0,Neural Information Processing Systems,"Mathematics,Computer Science"
6ecb8a743f92db6c6b8691ab8e8aebbb06fb1b48,Averaged-DQN: Variance Reduction and Stabilization for Deep Reinforcement Learning,2016.0,International Conference on Machine Learning,"Computer Science,Mathematics"
4ab08b2f1193d770c241b41f5d9f1c841a3663d3,Optimizing Chemical Reactions with Deep Reinforcement Learning,2017.0,ACS Central Science,"Medicine,Computer Science"
2fdb536da39a014c598ea67b0db88431fcd852a8,Doubly Robust Off-policy Value Evaluation for Reinforcement Learning,2015.0,International Conference on Machine Learning,"Computer Science,Mathematics"
8423cc50c18d68f797adaa4f571f5e4efbe325a5,A Laplacian Framework for Option Discovery in Reinforcement Learning,2017.0,International Conference on Machine Learning,"Computer Science,Mathematics"
9ea92ebeb7462f2db346cfa3281ad7497b1063d6,Deep reinforcement learning with relational inductive biases,2018.0,International Conference on Learning Representations,Computer Science
ea6d73a33ac2109ed095963e25b857a9350449bd,Bayesian Reinforcement Learning: A Survey,2015.0,Found. Trends Mach. Learn.,"Computer Science,Mathematics"
3ee01ec27e4e66e089b72a9989724be611c2ad90,Neural Map: Structured Memory for Deep Reinforcement Learning,2017.0,International Conference on Learning Representations,"Computer Science,Mathematics"
753d1f31ef1bdee51e01d33e33e2b153a65ed978,The drift diffusion model as the choice rule in reinforcement learning,2017.0,Psychonomic Bulletin & Review,"Psychology,Medicine"
a3be639d7e915b5f4e1499e52e1fcfd0940a31e5,Paraphrase Generation with Deep Reinforcement Learning,2017.0,Conference on Empirical Methods in Natural Language Processing,Computer Science
62c16289e72ffecfa68e8b3d8f42f2e1eb9be25b,A Deep Reinforcement Learning Chatbot,2017.0,arXiv.org,"Computer Science,Mathematics"
bc9f3c466c6f6b386f4ef1195853d498cf3c182e,Mapping Instructions and Visual Observations to Actions with Reinforcement Learning,2017.0,Conference on Empirical Methods in Natural Language Processing,Computer Science
af64497a418cf62016251360d9ba537604f7622a,Efficient Exploration in Reinforcement Learning,2017.0,Encyclopedia of Machine Learning and Data Mining,Computer Science
3deecaee4ec1a37de3cb10420eaabff067669e17,Stochastic Neural Networks for Hierarchical Reinforcement Learning,2016.0,International Conference on Learning Representations,Computer Science
3b2aff88ee03e82993c066c3e698d51da62d5496,Deep Reinforcement Learning in Large Discrete Action Spaces,2015.0,,"Computer Science,Mathematics"
aa8e4263ef59d095dc0f87fb0dae19b441bfa6c5,Opponent Modeling in Deep Reinforcement Learning,2016.0,International Conference on Machine Learning,"Computer Science,Mathematics"
a729073d3ec9a159b86fd438e06f3dff2735beb5,Deep Reinforcement Learning for Sepsis Treatment,2017.0,arXiv.org,Computer Science
92d621a603cda8c32214d70953e180fe5a442f3e,N2N Learning: Network to Network Compression via Policy Gradient Reinforcement Learning,2017.0,International Conference on Learning Representations,"Computer Science,Mathematics"
b542d5f3973970902eab247154f74cc5abb5cbb4,Time Limits in Reinforcement Learning,2017.0,International Conference on Machine Learning,"Computer Science,Mathematics"
da981e00c5f4a2aa931d02ae2a3211b0a0ac1b63,Emotion in reinforcement learning agents and robots: a survey,2017.0,Machine-mediated learning,"Computer Science,Mathematics"
